{"$id":"urn:acme-firm:schema:formula-bindings:1.0.0","$schema":"https://json-schema.org/draft/2020-12/schema","additionalProperties":false,"description":"Contrato exacto de tres entradas y una salida distinta, con colisiones fail-closed.","properties":{"$schema":{"const":"../../schemas/formula_bindings.schema.json","type":"string"},"authorized_output":{"const":"output.coping_potential","type":"string"},"binding_id":{"const":"BIND-F6-COPING-001","type":"string"},"binding_map":{"additionalProperties":false,"properties":{"coping_potential":{"const":"host.baseline.coping_potential","type":"string"},"lambda":{"const":"influence.parameters.lambda","type":"string"},"result":{"const":"output.coping_potential","type":"string"},"z":{"const":"factor_state.level","type":"string"}},"required":["coping_potential","lambda","result","z"],"type":"object"},"binding_roles":{"additionalProperties":false,"properties":{"input_binding_count":{"const":3,"type":"integer"},"input_keys":{"const":["coping_potential","lambda","z"],"type":"array"},"output_binding_count":{"const":1,"type":"integer"},"output_key":{"const":"result","type":"string"},"result_is_input":{"const":false,"type":"boolean"}},"required":["input_binding_count","input_keys","output_binding_count","output_key","result_is_input"],"type":"object"},"collision_policy":{"const":"all twelve registry, resolved-config and implementation locations resolve to the four approved values; missing, duplicate, implicit or divergent bindings block the build","type":"string"},"decision_refs":{"const":["T03-RS-005","T03-RP-012","T03-MP-013"],"type":"array"},"expression":{"const":"coping_potential_out = clamp(coping_potential_in * (1 - lambda * z), 0, 1)","type":"string"},"formula_id":{"const":"F6-COPING-MOD-001","type":"string"},"formula_to_binding_key_crosswalk":{"additionalProperties":false,"properties":{"coping_potential_in":{"const":"coping_potential","type":"string"},"coping_potential_out":{"const":"result","type":"string"},"lambda":{"const":"lambda","type":"string"},"z":{"const":"z","type":"string"}},"required":["coping_potential_in","coping_potential_out","lambda","z"],"type":"object"},"input_bindings":{"additionalProperties":false,"properties":{"coping_potential_in":{"const":"host.baseline.coping_potential","type":"string"},"lambda":{"const":"spec/thesis/f6_specification_rc01.json#/influence/parameters/lambda","type":"string"},"z":{"const":"factor_state.level","type":"string"}},"required":["coping_potential_in","lambda","z"],"type":"object"},"not_attributed_to_published_rules":{"const":true,"type":"boolean"},"parameter_values":{"additionalProperties":false,"properties":{"lambda":{"const":"0.3","type":"string"},"lower_bound":{"const":"0","type":"string"},"upper_bound":{"const":"1","type":"string"}},"required":["lambda","lower_bound","upper_bound"],"type":"object"},"protected_dimensions":{"const":["expectedness","desirability","novelty","pleasure","goal_conduciveness"],"type":"array"},"provenance_layer":{"const":"thesis","type":"string"},"published_rule_access":{"additionalProperties":false,"properties":{"anger_2018b":{"const":"may consume only the coping category classified from the bounded output; it may not consume z, lambda or intermediate arithmetic","type":"string"},"sadness_2018a":{"const":"symbolic labels and contextual fixture only; no numeric formula values","type":"string"}},"required":["anger_2018b","sadness_2018a"],"type":"object"},"resolution_policy":{"const":"apply only declared bindings, validate types and domains, reject missing or conflicting targets, and record every resolved field's source layer","type":"string"},"schema_version":{"const":"1.0.0","type":"string"},"source_layers":{"additionalProperties":false,"properties":{"doctoral_specification":{"const":"spec/thesis/f6_specification_rc01.json","type":"string"},"engineering_decisions":{"const":"spec/decisions/engineering_v1.1.0.json","type":"string"}},"required":["doctoral_specification","engineering_decisions"],"type":"object"}},"required":["$schema","schema_version","binding_id","formula_id","provenance_layer","not_attributed_to_published_rules","expression","input_bindings","binding_map","formula_to_binding_key_crosswalk","binding_roles","parameter_values","authorized_output","protected_dimensions","published_rule_access","resolution_policy","collision_policy","source_layers","decision_refs"],"title":"IFATIGUE-INFRA6-M6 formula binding contract","type":"object"}
