{"$schema":"../../schemas/formula_bindings.schema.json","authorized_output":"output.coping_potential","binding_id":"BIND-F6-COPING-001","binding_map":{"coping_potential":"host.baseline.coping_potential","lambda":"influence.parameters.lambda","result":"output.coping_potential","z":"factor_state.level"},"binding_roles":{"input_binding_count":3,"input_keys":["coping_potential","lambda","z"],"output_binding_count":1,"output_key":"result","result_is_input":false},"collision_policy":"all twelve registry, resolved-config and implementation locations resolve to the four approved values; missing, duplicate, implicit or divergent bindings block the build","decision_refs":["T03-RS-005","T03-RP-012","T03-MP-013"],"expression":"coping_potential_out = clamp(coping_potential_in * (1 - lambda * z), 0, 1)","formula_id":"F6-COPING-MOD-001","formula_to_binding_key_crosswalk":{"coping_potential_in":"coping_potential","coping_potential_out":"result","lambda":"lambda","z":"z"},"input_bindings":{"coping_potential_in":"host.baseline.coping_potential","lambda":"spec/thesis/f6_specification_rc01.json#/influence/parameters/lambda","z":"factor_state.level"},"not_attributed_to_published_rules":true,"parameter_values":{"lambda":"0.3","lower_bound":"0","upper_bound":"1"},"protected_dimensions":["expectedness","desirability","novelty","pleasure","goal_conduciveness"],"provenance_layer":"thesis","published_rule_access":{"anger_2018b":"may consume only the coping category classified from the bounded output; it may not consume z, lambda or intermediate arithmetic","sadness_2018a":"symbolic labels and contextual fixture only; no numeric formula values"},"resolution_policy":"apply only declared bindings, validate types and domains, reject missing or conflicting targets, and record every resolved field's source layer","schema_version":"1.0.0","source_layers":{"doctoral_specification":"spec/thesis/f6_specification_rc01.json","engineering_decisions":"spec/decisions/engineering_v1.1.0.json"}}
